number,value,state,params_batch_size,params_beta1_d,params_beta1_g,params_beta2_d,params_beta2_g,params_lr_d,params_lr_g,params_optimizer_d,params_optimizer_g
0,,FAIL,64,0.5152433448197867,0.7893920803020481,0.932426799550258,0.7729313769771438,0.0048755562975544,0.005820086438488731,sgd,sgd
1,461.80721608975256,COMPLETE,32,0.07362974588253081,0.4354717165141394,0.6815786475116729,0.6608208767241435,0.009253774151513332,0.0009828522464316774,adam,sgd
2,518.0566316223963,COMPLETE,64,0.584629682887345,0.19007485701249885,0.7148779632695306,0.8117405378447442,0.004914298588706987,0.005693622919408086,sgd,sgd
3,479.9512436584869,COMPLETE,128,0.7619936488708399,0.7534026955412485,0.7834951420962095,0.6862055086098979,0.0031745120465729616,0.0001999915051974965,adam,sgd
4,,FAIL,128,0.029790298531459657,0.3827895749068771,0.7152662472357947,0.9054570096694778,0.003346090760228817,0.006344325822982375,adam,sgd
5,436.0685169847205,COMPLETE,128,0.030193206916538373,0.1596879337669831,0.9154978665379461,0.9921298338528857,0.001424655178188479,0.004858917791555254,adam,adam
6,482.5214754814658,COMPLETE,128,0.6823780627370538,0.4404733322059827,0.8342441757022049,0.9021472563759021,0.005705658130181296,0.000344888733484007,sgd,sgd
7,435.09449086596754,COMPLETE,128,0.8734814723210853,0.3653307738637917,0.9953153492242941,0.7373422313445329,0.00824314776792031,0.005907023419994369,sgd,adam
8,460.6716065727584,COMPLETE,64,0.03365048063442745,0.4978315804742482,0.6079315276831163,0.8941925882128552,0.0045162554640737,0.001812772123951217,adam,sgd
9,510.1033530888505,COMPLETE,128,0.48276294162749783,0.0010911357945499478,0.76924421399114,0.7214858053681847,0.007580897207153137,0.008410587581549861,sgd,adam
10,475.69586191095743,COMPLETE,64,0.6286314597291176,0.8357087866579913,0.9461920451323313,0.6499065647463054,0.0060229749488743085,0.008190358430452046,adam,sgd
11,464.1700355049136,COMPLETE,128,0.2587170876653363,0.8549258261956797,0.8607144223573966,0.9619512130652442,0.00761065292518066,0.004036848696955136,sgd,sgd
12,333.3957139489583,COMPLETE,32,0.9694476791285471,0.6380932819636997,0.5121861850196836,0.5118539355768621,9.68355288114564e-05,0.00669925917733883,sgd,adam
13,326.5564685834646,COMPLETE,32,0.9828509804944594,0.6116711437240915,0.5175708732172039,0.5017569900870833,4.253137804889499e-05,0.006652083118086393,sgd,adam
14,412.3670264324871,COMPLETE,32,0.9691307520333666,0.6761862309813118,0.5078569116207221,0.5042868224304698,3.3384961226745976e-05,0.007383307404183222,sgd,adam
15,349.4823907741572,COMPLETE,32,0.9828130123390175,0.6206536395646534,0.5054764664516697,0.5016201055880963,0.0003483208484000486,0.009560279099322175,sgd,adam
16,440.9357829156576,COMPLETE,32,0.8178643270612629,0.5939859954975184,0.5856343003293502,0.5779166908665533,0.0025822617563489537,0.0034659548127468046,sgd,adam
17,407.71007995823766,COMPLETE,32,0.8830807940845236,0.9304325959600076,0.5821446748271875,0.5789928273152705,0.0015070394742185053,0.006729528222604839,sgd,adam
18,478.61585674175393,COMPLETE,32,0.9789492316423963,0.7298808643122653,0.5537746663829792,0.5750561653419689,0.0014642447422752755,0.009690027791474754,sgd,adam
19,312.19400543635294,COMPLETE,32,0.7500306259812768,0.5627178056145771,0.6515989279975908,0.5501183839376578,0.0029477442318731305,0.002632098547200553,sgd,adam
20,439.2027299148093,COMPLETE,32,0.538570489440564,0.2856454360398246,0.6603526067891807,0.6109652198324476,0.003354707287744469,0.002759823640754218,sgd,adam
21,372.45172418945685,COMPLETE,32,0.44919315676357385,0.5238066458102386,0.6353167100126811,0.5577416695887021,0.0019567595021006603,0.001898755247869091,sgd,adam
22,395.5633828854049,COMPLETE,32,0.7402021295568592,0.3574317790124236,0.7216881373011145,0.621212017951486,0.003800594847328906,0.004521038155523088,sgd,adam
23,363.4401654839273,COMPLETE,32,0.8769972891493227,0.597170163055512,0.5432956926038744,0.5336225951885044,0.0005753058085968144,0.005756455544638042,sgd,adam
24,403.02571603259656,COMPLETE,32,0.7951584137169865,0.7649275192473661,0.5462790017212441,0.5341306524387942,0.002405879722979645,0.0070230817227557585,sgd,adam
25,365.90954710123947,COMPLETE,32,0.8884639110808901,0.5259244526568789,0.6302891774755804,0.5022070017477901,0.000955051714161306,0.008494278670583964,sgd,adam
26,414.5612353688961,COMPLETE,32,0.9267399225790771,0.6539034233726421,0.5032710876356883,0.6128057990744141,0.0008020917883742579,0.0031208434508212196,sgd,adam
27,470.93389510170164,COMPLETE,64,0.6938521914829722,0.7038817208276388,0.573194077736912,0.5411776405842972,0.0024502871719210405,0.006400681042657561,sgd,adam
28,448.43782168260964,COMPLETE,32,0.8196751557555065,0.9833955843244561,0.6899087996606104,0.5947341753334859,4.291859373123492e-05,0.007842484043425323,adam,adam
29,425.47674163974744,COMPLETE,32,0.3697641932667596,0.8077397037019282,0.6257999156340539,0.5418572885825389,0.004035618165739489,0.004758548461910471,sgd,adam
30,410.8477226719021,COMPLETE,32,0.6962036193241625,0.5757005326574465,0.541323077367051,0.6654425965907179,0.00577285521286309,0.0022858757129359565,sgd,adam
31,433.5108473386159,COMPLETE,32,0.26403287516245505,0.4306156498651037,0.6611278597153846,0.6394283545213395,0.0030218359764213835,0.009068927480911815,adam,adam
32,417.7056593844195,COMPLETE,64,0.831298047894772,0.44362495884981085,0.742464045978887,0.5306416569437997,0.009679645363410441,0.007373402985831558,sgd,adam
33,486.30441236446467,COMPLETE,32,0.985389386339094,0.6179024870038092,0.507716134698378,0.5157143174624971,0.0004710609614997077,0.009893112718925377,sgd,adam
34,489.9048854405519,COMPLETE,32,0.9228962675898812,0.6480918509601767,0.535409533353285,0.5008018256353176,0.001120083277235703,0.0012350611943003267,sgd,adam
35,392.8666975159592,COMPLETE,32,0.9405888248044357,0.5651750606546442,0.5982908150737725,0.5617669923810609,0.0019185595026472236,0.00929320956886881,sgd,adam
36,445.40940524406943,COMPLETE,32,0.7491449327894936,0.495481253805948,0.5025809213587528,0.5559654076035621,0.0002498312774790456,0.008972969895626211,sgd,sgd
37,484.1645459779362,COMPLETE,32,0.9846950916786501,0.7617937126896352,0.5676503633727933,0.5928246339585381,0.0017511307193947545,0.005113032634358801,adam,adam
38,424.22858037675996,COMPLETE,32,0.8496163279557153,0.688991604521736,0.6859966851577964,0.5018258023413984,0.0008922420757173468,0.00621921806862769,sgd,sgd
39,415.74798961730255,COMPLETE,64,0.6183400312140392,0.3878012071812734,0.7950327774013708,0.6920107729533843,0.004730159452170795,0.005266134973604523,sgd,adam
40,481.3861665100435,COMPLETE,128,0.7806717265294743,0.2842139142228548,0.5186331546866424,0.7908283593472027,0.005231343899498641,0.0008025362201429375,adam,adam
41,527.3922193884888,COMPLETE,32,0.9219137380526173,0.47916044286538717,0.6082672730868696,0.5278302157492015,0.006558059234256683,0.003996575584215898,sgd,sgd
42,411.69521338216236,COMPLETE,128,0.1525595043539375,0.5491992916958038,0.5277540583640487,0.5559643077386434,0.0029286116368797788,0.007786377838729504,sgd,adam
43,313.18415564884026,COMPLETE,32,0.8716230273478002,0.612938099817863,0.5613036444704472,0.528171495201116,0.0006094060159744575,0.005712467170942896,sgd,adam
44,448.38995135945197,COMPLETE,32,0.9137645422439918,0.6205737895081737,0.5619298056921536,0.5281730867095099,0.001175554385414626,0.005418425690273606,sgd,adam
45,323.58479789027894,COMPLETE,32,0.8593272696365124,0.6329764461690306,0.5291861000100193,0.5876117771533972,0.0004214297760784195,0.006216582760270329,sgd,adam
46,282.48262802263747,COMPLETE,32,0.7136707569515914,0.7149523388577462,0.6006247332367561,0.5959167890899661,0.0006227310131121604,0.006333441385415705,sgd,adam
47,472.3784231640887,COMPLETE,64,0.6357357214053502,0.789511480617537,0.6565559829425671,0.6346638241348581,0.002198394882700455,0.0060169525902996086,sgd,sgd
48,474.30857896121614,COMPLETE,128,0.7232675112305771,0.8524115205293332,0.6047648915991811,0.6765911716837968,0.0013436425783349471,0.004287043034283739,adam,adam
49,464.6192593515438,COMPLETE,32,0.5633825355435546,0.7297402161735789,0.5919472182487244,0.5945770161946782,0.0006162492132782329,0.006734624969824212,sgd,adam
50,498.07467326240555,COMPLETE,32,0.6583132148009393,0.9009754774436085,0.6199491944078672,0.7082905423597265,0.008682835121090506,0.00554250778946286,sgd,adam
51,507.9319974220434,COMPLETE,32,0.7700818216972777,0.05040426284311861,0.6460251098452429,0.585065031654229,0.0014979096937856634,0.007344868191998749,sgd,adam
52,419.7113714453461,COMPLETE,32,0.8512358170677131,0.7167320404065026,0.5684489996696027,0.7587811118990022,3.4037479327861365e-05,0.006387499541449365,sgd,sgd
53,313.4126437365196,COMPLETE,32,0.7916921551936499,0.6544563221173313,0.5292207893391394,0.5645168036879568,0.0005576013953608192,0.006536106968488931,sgd,adam
54,331.7355048273926,COMPLETE,32,0.7940814364820241,0.6897109042157802,0.5335870672024355,0.5683128547099305,0.0006348489790295645,0.005982393565884868,sgd,adam
55,451.27704201108116,COMPLETE,32,0.7116434579611667,0.6587393738037725,0.5858145650662793,0.6199719610663472,0.0009923199561097129,0.007080222574985847,sgd,adam
56,373.448801402295,COMPLETE,32,0.8479755231627997,0.5925022783626175,0.5549923004324565,0.8781407772624494,0.00038988753541532227,0.00804166483896107,sgd,adam
57,441.0936682673143,COMPLETE,32,0.75262385880096,0.5314061821038925,0.8883526981891051,0.6041282801785655,0.0018690745996784708,0.006701314069086186,sgd,adam
58,403.961404586473,COMPLETE,32,0.8851129175219304,0.4810433621563114,0.5224307366562877,0.5569940075583669,0.003840411084745719,0.003674873026336892,sgd,adam
59,409.91383785058866,COMPLETE,128,0.8043880099846308,0.6618748994562786,0.7103791910633326,0.6501379629956002,0.0016279904298100458,0.00567189929426704,sgd,adam
60,381.70833175100455,COMPLETE,32,0.6756634267453712,0.7462036461369792,0.6167318978846258,0.5790084103881371,0.0012519278054758606,0.0047539327431675585,sgd,adam
61,441.46917931029463,COMPLETE,64,0.596479502159542,0.808266780708031,0.5776855749369376,0.6305700153684057,0.0033954477402688595,0.006998285040825308,adam,adam
62,424.18575645535327,COMPLETE,32,0.9445657502404995,0.6170674183480174,0.5550788738084935,0.545016592273452,0.0006663395037732841,0.007649035083770146,sgd,adam
